ELECTRICAL,Mixed signal control electronics design,,Veeresh Deshpande,"The project involves design of PCB with mixed signal circuits comprising of ADCs, DACs, Op-amps etc. The board is needed control scanning tunneling microscope stage. The electronics board can be FPGA based or microcontroller based to perform fast collection of data from ADCs and supply voltage to DACs.

Another project involves improving an existing board for memory chip measurements. The design should improve the speed of measurement with advanced ADCs, DACs etc.",2,Students entering 4th/5th year,above 8.5,"PCB design, analog circuit design",6 months,,Yes,20,nil
"ELECTRICAL
AI/ML",Data Sanitization in Artificial Intelligence,,Prof Sandip Mondal,"Erasing information as a form of data from NAND flash memories suffers heavy overheads. Present resolutions comprise disconnecting the physical page addresses which makes data unreachable through typical lines, nevertheless, they bring the risk of data leakage. The SLC NAND flash memories have been. Data overwrite has been proposed with all-zero-in-place which is only applicable to the SLC NAND flash memories. This proposal introduces an immediate page data sanitization method for 3D MLC NAND flash memory devices that avoids leakage of erased information without any adverse effects on effective data in shared pages",2,Students entering 4th/5th year,above 8.5,Strong backgroup of Python,1 year,"3D NAND flash memory for Artificial Intelligence, Patent and International (USA) presentation",Yes,20 Hrs,https://www.youtube.com/watch?v=45HAfu719iw
"ELECTRICAL
MECHANICAL",Development of embedded hardware and software (using TIVA) for innovative microneedle printing machine ,,Prasanna Gandhi,"Innovative techonology and process of microneedle fabrication has been established successfully in our laboratory at IIT Bombay. This project proposes development of embedded hardware board (with TIVA shield) using EAGLE or equivalent software and programming corresponding interfaces for printing the desired array of microneedles in a patch template. Mechanical part involves putting together xy motion stages, optical shutter, mirrors and lenses together in the system in a robust and user friendly manner.  ","1 (mechanical), 1 (electrical)","Students entering 3rd year, Students entering 4th/5th year",above 7,Prior background on microcontroller programming and PCB design for EE required and hands on project for ME required. ,60 days,,Yes,40,sincerity and ethics 
"ELECTRICAL, SYSCON",Microrobotics,,Ashwin A. Seshia,This project will involve the design of piezoelectric actuators for milli-scale robots. The project will commence with surveying the literature in the field and associate models for the actuators and robot structures. The insight generated will be applied to the design of prototype devices based on off-the-shelf actuators and bench-level encapsulation/packaging methodologies. The project if successful may be continued over the semester period.,1-2,"Students entering 2nd year, Students entering 3rd year, Students entering 4th/5th year",above 7.8,Interview will be held for selection.,2-3 months,"modeling, design, fabrication, packaging, and encapsulation of microelectromechanical devices and systems.",Yes,40,nil
"ENERGY
CLIMATE STUDIES",Visualizing climate impact: a dashboard for spotting hotspots in cities,,Karthik Sasihithlu,"Our research group has developed a methodology to extract local land surface temperatures (LST) from freely available satellite imagery, including data from LANDSAT and MODIS platforms. This approach enables high-resolution, city- and ward-level mapping of temperature variations, allowing us to monitor the impacts of urbanization, concretization, and vegetation loss on microclimatic conditions.

To make this information accessible and actionable for the general public, we will be developing an interactive online dashboard that will feature approximately 20 major Indian cities. The key features of this dashboard will include:  a) Daily updates of land surface temperature data, sourced from satellite imagery. b) Ward-wise average LST maps to highlight local variations within cities. c) Hot spot cluster identification, updated in near real-time, to indicate zones experiencing critical heat stress. d) Time-series plots showing the evolution of land surface temperatures in specific regions or localities over the past 20 years, helping to illustrate long-term urban heat trends.  This tool will serve as a public-facing platform for climate awareness, enabling citizens, researchers, and policymakers to track urban heat island effects and assess the consequences of changing land use patterns at a highly localized level.",2,"Students entering 2nd year, Students entering 3rd year",above 6,"Prior experience in user interface (UI) development is highly desirable. The project requires building an interactive dashboard, and candidates are expected to be self-sufficient in this aspect.

Familiarity with web development frameworks will be a significant advantage.

Experience in working with geospatial data (especially satellite imagery from platforms like LANDSAT or MODIS) is a plus.

Knowledge of tools such as Google Earth Engine, QGIS, or GDAL will be considered beneficial.",2-3 months,"Using satellite imagery to extract useful information such as land surface temperature, vegetation etc.  Awareness about ongoing efforts to combat long term climate-change effects ",No,20 hours,"Please join only if you are truly interested in contributing. 
We are answerable to the funding agency, and will be affected if students join only for namesake.  There will be weekly meetings too"
ENERGY,Data driven analysis of fluid drag on irregularly shaped particles,,Manaswita Bose,The objective of the project is to develop drag correlations based on simulation results. Preliminary CFD simulations with body fitted mesh will be performed using standard software. The data generated using these simulations will be used for the analysis or development of correlations. ,1,Students entering 3rd year,none,Fluid Mechanics and interest in computer coding,two months,,"The student may work from home; however, weekly reporting is expected",40,nil
ENERGY,Redox flow batteries,,Manoj Neergat,"Project Description 

This project aims to investigate different redox-active species to enhance the overall performance of redox flow batteries (RFBs). RFBs offer a distinct advantage in energy storage by decoupling energy capacity from power output. In RFBs, energy is stored in external electrolyte tanks, while the electrochemical reactions occur in a separate flow cell. The focus is to explore various redox systems and their electrochemical properties to improve energy density, power density, and cost-effectiveness of RFBs. These redox couples will be electrochemically characterized using a three-electrode setup through techniques such as cyclic voltammetry (CV), electrochemical impedance spectroscopy (EIS), chronoamperometry, and chronopotentiometry. Through electrochemical investigation and kinetic analysis, the project aims to contribute to the development of RFBs with improved efficiency. 

 ",2,"Students entering 2nd year, Students entering 3rd year, Students entering 4th/5th year",none,Nil,3 months,Characterization of electrochemical systems and device fabrication,No,35 h,nil
ENVIRONMENTAL STUDIES,Weather forecasting to support air quality modelling,,Srinidhi Balasubramanian,"WRF model is widely implemented to generate gridded weather fields as input to chemical transport models (CTM). This project will (i) generate multi-high spatial resolution weather fields for India, (ii) evaluate accuracy and scale-specific responses in comparison to ground based monitoring stations and other data products, (iii) integrate the model outputs into a CTM, and (iv) evaluate outcomes for wet and dry deposition when gridded CTM outputs are obtained.",1,"Students entering 3rd year, Students entering 4th/5th year",above 7.5,"Experience with weather models or earth systems, air quality models",3 months,"1. Hands on application of a weather model
2. Fundamental understanding of atmospheric processes
3. Literature understanding of air pollution model studies in India","Hybrid, with remote access to resources in PI lab",20-40 hours,"TImely communication, elaborate documentation for weekly progress reporting."
MANAGEMENT (SOM),Using NLP for financial text mining,,Piyush Pandey,"NLP has made textual data mining easier for financial analyst for incorporating qualitative data into valuation, risk management, and developing profitable trading and investment strategies. The project entails extracting news from database, classification of news into various financial topics and characteristics measurement of news such as sentiment, relevance, complexity or ambiguity.",2,"Students entering 3rd year, Students entering 4th/5th year",above 7.5,Understanding of NLP,3 months,Application of NLP for text mining in the financial markets ,Hybrid is fine but in person preferable,12,Sincerity is a must and interest in financial markets. Basic Idea of NLP is must (CSE/EE preferable)
MATHEMATICS,Permutation polynomials,,Harish Pillai,"Polynomials over a finite field that evaluates to a permutation of the finite field are called permutation polynomials. The project involves studying properties of such polynomials. It would require the student to understand finite fields and for any meaningful push forward, would require a lot of experimentation using computers. So programs need to be written and results need to be collated and analysed.",1 - 2,"Students entering 2nd year, Students entering 3rd year, Students entering 4th/5th year",none,It would be good if the person knows what a finite field is !! Knowing linear algebra well would be an advantage. ,A few months depending on interest,,No,Ten hours,It is helpful if the student likes to solve puzzles. 
MECHANICAL ENGINEERING,Computational investigation of droplet interaction with inclined hot plate,,Abhijeet Kumar,"This topic is in context of Infrared Suppression System (IRSS) for naval ships where spray is introduced in hot plume gas flow to cool them down. However, some of the drops interact with hot wall of the exhaust duct of naval ships. This works aims to explore this mechanism.",1,"Students entering 3rd year, Students entering 4th/5th year",above 8,Student should have crystal clear understanding of fluid mechanics and thermodynamics. Knowledge about simulation through ANSYS Fluent or COMSOL is preferable. ,1 year,Student will come to understand how a fundamental concept is applied to the practical problems and resolve those problems.,Yes,6-8,nil
MECHANICAL ENGINEERING,In situ velocity measurement of high speed bullets using optical velocity gate or chronograph.,,Krishna Jonnalagadda,"In this project, the student will develop mechanical, optical and electronic hardware based on either NI or Arduino platforms to measure the horizontal and vertical velocity of a bullet flying inside a tube.",1,"Students entering 2nd year, Students entering 3rd year, Students entering 4th/5th year",above 7,"Some knowledge of electrical circuits, programming in Arduino IDE or NI Labview, CAD modeling are required.",3 months,System integration and hardware-software development to measure physical quantities relevant to industry and R&D. ,Yes,30,Should work in the lab in collaboration with other students.
MECHANICAL ENGINEERING,Smart phone based flow visualization for indoor air quality monitoring,,Manaswita Bose,"Indoor air quality is important for a healthy learning environment. The objective of the project is to develop a simple flow visualization toolkit to understand the air flow in a classroom/lab under different ventilation condition and relate that to the droplet deposition and transportation. 
The simple measurement technique developed may also have other application areas.",2,"Students entering 3rd year, Students entering 4th/5th year",above 7,Interest in experiments and exploring new ideas,summer months (May-July),Experimental method to measure fluid flow using simple tools.,Yes,30-40 hours,Weekly update
MECHANICAL ENGINEERING,Implementation of servo control for ball screw system using STM 32 microcontroller,,Prasanna Gandhi,Ball screw drive system with servomotor as actuator and encoder on output stage as sensor has been developed at our laboratory for high precision application. This project involves simulation and practical implementation several control algorithms and comparison of their effectiveness in achieving the desired precision positioning goal. Solid foundation in microcontroller programming and automatic control is required for the project (ME 310 or equivalent and ME 311 or equivalent should have been completed).  Trajectory tracking would be further needed to be implemented. ,1,Students entering 4th/5th year,above 8,YES + ME 310 or equivalent and ME 311 or equivalent should have been completed and inclination towards experimental work. Well grounded in fundamentals. ,2 months,thorough knowledge in practical implementation of control algorithms handling sticky issues such as friction. ,Yes,40 hrs min in the suman mashruwala advanced micro-engineering laboratory. ,nil
MECHANICAL ENGINEERING,Dynamics of Kirigami Metamaterials,,R. Ganesh,"Metamaterials are a class of artificially designed structures whose properties are a function of the constituent material, as well as the geometry/topology of the structure. For example, an auxetic 2D-Lattice subjected to a uniaxial stretch expands in the orthogonal direction, thereby demonstrating an effective “negative” Poisson’s ratio (in contrast, the constituent material has a positive Poisson’s ratio). Since the architecture or geometry plays an important role in the unconventional properties, Kirigami, the art of cutting paper to form 3-D shapes starting from 2-D sheets has been found to be quite relevant to the design of mechanical metamaterials. Specifically, application of load to a 2-D sheet architected with small cuts induces out-of-plane buckling of the individual links, and results in the introduction of bending stiffness to the structure (which is negligible in the uncut specimen due to its negligible thickness). An interesting application of these structures is in the field of soft robotics, where shape morphing is employed to elicit locomotion through deformation. However, most studies focus only on rectilinear locomotion. In this project, we will intend to explore the ability to achieve shape morphing and realize various modes of deformation-induced locomotion (such as bending/twisting) through a localized dynamic excitation and making it completely reversible.",1-2,"Students entering 3rd year, Students entering 4th/5th year",above 7,At least BB or above in ME 223 (or equivalent). ,Two Months. Can continue as SLP/BTP based on progress.,Advanced Finite Element Analysis of structures used for Soft Robots. Experimental manufacturing and testing of Inflatable robotic structures.,Yes,20-40 hrs based on availability,"Students will have to stay on campus during the summer. Further, they should not be involved in more than one additional project/group related work during the summer.  "
MECHANICAL ENGINEERING,Indusrty 4.0/IoT protocols for Ultra Precsion Manufacturing Industry,,Rakesh Mote,"Ultra precision manufacturing caters need of high-tech components for strategic, nuclear, astronomical applications. The project involves feasibility study to implement Industry 4.0 and IoT to ultra precision Manufacturing.",2,"Students entering 3rd year, Students entering 4th/5th year",Above 7.5,"Some exposure to solid modelling/VR packages, Mechatronics, LabVIEW interfacing or similar ",3-6M,,Yes,Min 15 hrs,nil
MECHANICAL ENGINEERING,ML based object detection for security scanning systems using high energy beams,,Rakesh Mote,This is collaborative project wherein high energy beams being utilized for hidden object detection via image/spectra analysis.,1-2,"Students entering 3rd year, Students entering 4th/5th year",Above 7.5,"Understanding of data analysis, ML algorithms. Some knowledge of image processing would be an advantage.",2-6 months,,Some field work in the Navi Mumbai based high energy beam facility ,At least 2-3 days per week on the field during summer,nil
MECHANICAL ENGINEERING,Modelling and Fabrication of Aspheric/Free-from Surfaces for X-ray Telescope,,Rakesh Mote,"Aspheric or  free-from surfaces are gaining popularity for various space, biomedical optics. The complex nature of the surfaces poses challenges in their modeling, fabrication and metrology. The project aims at quantification and tool path optimization of such surfaces.",1-2,"Students entering 3rd year, Students entering 4th/5th year",Above 7.5,"Sound understanding of mathematics/geometry, graphics, programming skills using matlab or python",2-6 months,,"Not for whole period, however, continuous interaction is needed",Min 20 hours during summer,nil
MECHANICAL ENGINEERING,Automated Tool Wear Analysis,,Soham Mujumdar,"This project aims to develop cutting-edge algorithms combining machine learning and image processing to automate the analysis of optical images of cutting tools (drills, endmills, etc.). The primary goal is to accurately determine geometrical parameters (dia, angles, etc.) and detect tool wear. The project will involve data collection, image preprocessing, machine learning model training, and the creation of a user-friendly interface. 
Requirements, 
1.	The objective is to develop a software to determine geometrical parameters (dia, angles, etc.) and measure tool wear (in mm) from optical images. Here are the requirements, 
a.	Must work with images with different magnification levels (the images will include scale-bars)
b.	Should be automated with minimal user intervention and the ability to batch-process
c.	Achieve measurement accuracy within a tolerance of less than 10%, validated through verification on ten randomly selected test images.
2.	Students have the flexibility to choose any tools or technologies to fulfill the specified requirements. Sample images will be provided initially for development and testing purposes. In the event that a substantial number of images are necessary, it is the responsibility of the students to collect the additional images required for the project.
3.	Students are required to submit regular progress reports at least once every two weeks.
4.	Until project deliverables are successfully met, students are not permitted to include this project on their resumes/CVs.
5.	The developed software will be released as open source. ",2,"Students entering 2nd year, Students entering 3rd year, Students entering 4th/5th year",above 7,Sufficient knowledge of coding and image processing.,3 months,"Hands-on experience of working on a real-world problem, image processing skills, research experience",No,4,"Students are required to submit regular progress reports at least once every two weeks.
Until project deliverables are successfully met, students are NOT permitted to include this project on their resumes/CVs and will NOT be provided any LoR.
"
MECHANICAL ENGINEERING,Image-Based Characterization of Coatings,,Soham Mujumdar,"Students will be responsible for developing and applying advanced image processing techniques to analyse surfaces and coatings. The goal is to extract meaningful surface characteristics from image data.
 
Subtasks 1: Coating Thickness Estimation
 Develop image processing algorithms to estimate coating thickness in the micron range from high-resolution surface images.
 
Subtasks 2: Surface Roughness Prediction
Use statistical methods (or ML) to predict surface roughness parameters based on image features. Correlate image-based predictions with physical measurements (e.g., Ra, Rz).
 
Subtasks 3: Image Segmentation
Implement image segmentation techniques to distinguish coated regions, defects, or different surface zones.",2,"Students entering 2nd year, Students entering 3rd year, Students entering 4th/5th year",above 7,Sufficient knowledge of coding and image processing. ,3 months,"Hands-on experience of working on a real-world problem, image processing skills, research experience",No,4,"Students are required to submit regular progress reports at least once every two weeks.
Until project deliverables are successfully met, students are NOT permitted to include this project on their resumes/CVs and will NOT be provided any LoR."
MECHANICAL ENGINEERING,Robotic Additive Manufacturing and Coating,,Soham Mujumdar,The project requires the student to develop interface to convert the part drawing into a tool path in the robot-specific language. It will be used to 3D print complex metallic components or to create polymer coatings over complex surfaces.  ,2,"Students entering 3rd year, Students entering 4th/5th year",above 7,"Should have a good knowledge of robotics, controls, electronics, data acquisition, CNC",3 months,"Hands-on experience of working on a real-world problem, image processing skills, research experience",Yes,8 hrs,"Students are required to work with graduate students in the lab and submit regular progress reports at least once every two weeks.
Until project deliverables are successfully met, students are NOT permitted to include this project on their resumes/CVs and will NOT be provided any LoR."
MECHANICAL ENGINEERING,Design and Fabrication of a Torso Segment Constrained in a plane using Air Bearing.,,Vivek Sangwan,"For testing walking control algorithms, walking are robots are constrained to walk in a plane. The goal of this project is perform electrical, mechanical and pneumatic design and fabrication of a torso module of the biped constrained in to move in a single plane using air bearings between against glass surfaces.",3,"Students entering 2nd year, Students entering 3rd year, Students entering 4th/5th year",above 7,No per-requisites but experience in mechanical design will be a plus,Summer,Mechatronics Design and Fabrication Skills,Yes,20,Willingness to independently read and understand material relevant to project and use it to implement ideas.
MEMS,Strain measurement in functional thin films using geometric phase analysis,,Abhinandan Gangopadhyay,"Strain-engineering of thin films is useful for various optoelectronic device applications such as solar cells, lasers, infrared photodetectors, etc. This project aims to measure nanoscale strain in novel functional thin films. Geometric phase analysis (GPA) of dot-like high-resolution (scanning) transmission electron microscope images will be utilized to map strain field at nanometer-scale. Two non-colinear reciprocal lattice vectors will be masked in Fourier space and the phase components of the Bragg filtered images will be used to generate displacement and strain map. The reliability of the generated strain maps will be evaluated by detailed consideration of sources of errors.",1-2,"Students entering 2nd year, Students entering 3rd year, Students entering 4th/5th year",above 7,Beginner level image processing experience will be useful. ,2.5 months,Strain analysis in thin films,No,40,nil
MEMS,Simulation of microstructure evolution during metal additive manufacturing,,Durga A.,"Ever wondered what happens inside a material while it is being 3D printed? In this project, you will develop a model to predict the structure at the microscale when a metallic alloy is 3D printed using a fusion-based process. Predicting this microstructure will enable us to tailor the process to obtain a suitable microstructure that would provide the best possible properties and performance. The project will involve formulating a mathematical model to describe the evolution of the microstructure and then implementing the same in Python to predict the microstructure evolution in a real metallic alloy that is being 3D printed.",2,"Students entering 3rd year, Students entering 4th/5th year",above 7.5,Good math ability and basic programming skills,2 months,Ability to formulate a materials science problem mathematically and solve it numerically.,No,30,nil
MEMS,Recycling of Urban Ores (spent Li-ion batteries/Solar panel/Magnet),,Jayasree Biswas,"Urban ores—such as spent lithium-ion batteries and waste solar panels—contain substantial amounts of valuable metals that are classified as critical minerals by the Ministry of Mines. Improper disposal of these materials can lead to the release of toxic substances, posing environmental and health risks. Therefore, recycling and recovering metals from urban ores is essential to support material circularity and ensure a stable supply chain. This project will focus on exploring pyro- and hydro-metallurgical processes through experimental investigations and material characterization. ",2,"Students entering 3rd year, Students entering 4th/5th year",above 8,From Chemical/Metallurgy,2 months,,Yes,Around 20-30 hours,nil
MEMS,Graphene based water/air filtration,,Shobha Shukla,"Graphene offers a versatile platform for the adsorption of various pollutants. Through this project, we plan to utilize graphene for trapping arsenic, iron and other floating pollutants. Extensive testing will be done to ensure trapping and degradation dynamics/mechanism. Finally prototype development will be done to check the applicability of the system. ",2,"Students entering 3rd year, Students entering 4th/5th year",above 7,Electronics exposure would be good,6months,"Materials, sustainable practices",Yes,30 -40 hours,sincerity and perseverance
