MULTIDISCIPLINARY,Modeling and solving combinatorial optimization models using Minotaur solver,,Ashutosh Mahajan,"Minotaur is an open-source solver for combinatorial and nonlinear optimization models that arise in various practical applications including logistics. One goal would be to understand and develop plans for movements of trucks in a logistics network so that periodic demands are efficiently transported over long distances. Consolidated movements that are cost effective, and also satisfy time requirements of deliveries are the performance measure in this case. Innovative heuristics that may require parallel search on multiple CPUs or a GPU can be tried.",1,"Students entering 2nd year, Students entering 3rd year, Students entering 4th/5th year",above 7.5,"Student should have interest in mathematical optimization and computing. Student should be comfortable in programming C++, Julia or Python.",About two months,The student will learn how to model and solve optimization models discrete variables that arise in many practical applications. They will understand some algorithms (exact and heuristics) for such models. They will gain proficiency in implementing and testing them.,No,20,The student is expected to work closely with PhD and MTech students in the professor's group.
MULTIDISCIPLINARY,Keeping track of traffic on campus,,Ronnie Sebastian,"I am interested in using tools available to solve some real life problems. One of the issues which I face, and others face too, is the increasing amount of traffic on campus. I want to develop some tool using which we can keep track on the number of vehicles on campus at any given time. Theoretically, this can be easily achieved using available tools. However, I would like to work this out in the specific instance of IIT-B campus. ",3,"Students entering 3rd year, Students entering 4th/5th year",above 8.5,"Good communication skills, you should be someone who respects his/her commitments, resourceful. ",Not sure.,"It may give us an idea of how to go about solving real life problems. I guess there are many such problems around us, waiting to be solved, and so this experience may be a useful and interesting one. ",Yes,"30. I am assuming you will not be doing any other project, and so you should be able to put in about 6 hours per day, 5 days a week. ",nil
PHYSICS,Imaging with Compton scattered photons in Positron emission tomography,,Prof. Pragya Das,"Positron Emission Tomography (PET) is an advance imaging technique in nuclear medicine.  The image quality suffers from various types of noises, of which Compton scattering is a major component in degrading the image quality.  In the conventional PET, Compton scattered part is carefully estimated and discarded from the main data.  With the advent of list-mode data collection, it is possible to isolate the scattered events because the locus of the scattering point lies on a prolate surface.  Our idea is to construct images using the scattered events and later merge them with the main data.  So, instead of discarding the scattered data as noise, we can utilize them, thereby improving the signal to noise ratio significantly.  Developing models is one part of our project, and to apply various deconvolution techniques to improve the image quality is another one.",2,"Students entering 3rd year, Students entering 4th/5th year",above 8,"Computer programming, C-language, MATLAB, Monte Carlo simulation",2-3 months,To gain knowledge in Physics and computational aspects of biomedical imaging techniques.,"Partly stay in campus (say, 3-4 weeks).",12 - 16 hours.,Academic honesty and keen desire to learn.
PHYSICS,Imaging with scattered photons with known time-of-flight in Positron emission tomography,,Prof. Pragya Das,"Positron Emission Tomography (PET) is an advance imaging technique in nuclear medicine.  Conventional PET employs various techniques to reject scattered data as it creates noise in the reconstructed image. Instead of discarding 30-60% of the coincidence events belonging to single-scattered (SS) category, we propose a novel algorithm that utilizes such events to generate images.  While previous studies in literature have explored SS imaging using both Time-of-Flight (TOF) and energy information, our approach extends this capability to plastic scintillators with only TOF information.  This proves particularly beneficial for low-count plastic PETs with very good timing resolution.  We plan to validate our model using experimental data from J-PET facility (Jagiellonian University, Poland).",1,Students entering 4th/5th year,above 8,"Computer programming, C-language, MATLAB, Monte Carlo simulation",2 - 3 months,Physics ideas utilized in Biomedical imaging,Partly stay in campus (say 3 - 4 weeks),12 - 16 hours,Academic honesty and keen desire to learn.
SYSCON,RL based multiagent patrolling ,,Arpita Sinha,This project focuses on the patrolling problem where multiple vehicles visit some locations in a region repeatedly to ensure there is no security breach. The path planning and decision making algorithms have to be developed for these vehicles. A senior PhD student has developed a heuristic algorithm. We expect the intern to improve the algorithm by using RL-based methods. Knowledge of Python and ROS is required. We will be using SUMO for the simulations. ,1,"Students entering 3rd year, Students entering 4th/5th year",none,Knowledge of Python and ROS.,3 months,"(1) Developing multiagent algorithm using RL. 
(2) Knowledge of platforms like SUMO for testing.
(3) Drafting manuscripts.",Yes,20 hours,Full commitment in the project. 
"SYSCON
ENERGY",High-performance motor drive systems for electric vehicle applications,,S Ravi Prakash Reddy,"The adoption of electric vehicles (EVs) is increasing globally due to various environmental concerns. The core element in EVs, apart from EV battery, is the motor drive system that replaces internal combustion engine. The most widely used machines for EV applications are induction machines (IM), permanent magnet synchronous machines (PMSM), brushless DC (BLDC) machines and reluctance machines. In this project, the modelling, speed control and closed loop controller design aspects of  EV drives will be carried out, with a scope for employing high-performance control schemes that maintain robustness as well as transient performance characteristics.",2,"Students entering 3rd year, Students entering 4th/5th year",above 7,Prior knowledge in the area of motor drives and control systems will be helpful,3-6 months,,Yes,3,nil
"SYSCON
ENERGY",System Identification/Parameter Estimation Using Optimisation Techniques,,S Ravi Prakash Reddy,"Accurate knowledge of system parameters becomes very important in various applications. Estimating these parameters using optimisation methods involves minimising cost/objective function by iteratively estimating the model parameters. Accurate convergence of parameters being estimated becomes a major concern, especially while dealing with complex dynamic systems. This project aims to investigate various optimisation techniques to accurately estimate parameters of a physical system, using both the time domain and frequency domain approaches. ",2,"Students entering 3rd year, Students entering 4th/5th year",above 7,Knowledge in the area of control systems and optimisation techniques is desirable,3-6 months,,Yes,3,nil
"SYSCON
MATHEMATICS
MULTIDISCIPLINARY",Gradient approaches to optimal function learning,,Debasish Chatterjee,"An open problem in signal processing posed in 1977 demanded a numerically viable algorithm to solve the optimal function learning (interpolation) problem. A solution was recently offered in https://doi.org/10.1016/j.sysconle.2023.105648 (arXiv version https://arxiv.org/abs/2307.01304), building on some recent developments in convex semi-infinite programs. Such semi-infinite programs are NP hard; however, some NP hard problems admit excellent approximations, and the optimal function learning problem is one such. This project is directed at the development gradient approaches to solving the optimal function learning problem up to pre-assigned accuracy.

Preliminary results in this direction (using nonsmooth gradient methods) have demonstrated, on average, several hundred fold improvement in performance on 67 benchmark problems relative to state-of-the-art solvers. The ideas may be employed, among other things, to develop a new class of methods for signal in-painting, e.g., optimal inpainting for corrupted audio signals, etc.",3,Students entering 2nd year,above 8,Sufficient mathematical maturity and seriousness. Students will need time to absorb the material and it is not easy.,Minimum 1 year.,"Solid grounding in cutting-edge techniques of variational analysis, stability of constrained optimization, and function learning. Our objective is to develop new algorithms and techniques, and the project will require serious and sustained dedication over at least 1 year.",No,20 hr during the summer and at least 8 hr during the semester.,Only serious students interested in learning the subject may consider applying. This is not a project that will lead to quick outcomes.
,Develop STS India Network portal with user authentication,,Mahendra Shahare,"Science and Technology Studies India Network is an academic community and has a basic functional website. Your task is to scale it to a full fledged portal with user authentication system, public and access defined content for the site. Integrate with Youtube and host podcast feature. Possibly also integrate payment systems to work with UPI/Indian banks. Auto generated membership emails, list server etc.",1,"Students entering 3rd year, Students entering 4th/5th year",above 5,Good programming skills for web portal development,2 months,Skills for web development and content organisation.,No,10 hrs,nil